{
  "schemaVersion": 1,
  "id": "demo:map.supply-room",
  "name": "Workshop Supply Room",
  "orientation": "orthogonal",
  "tileSize": 16,
  "width": 8,
  "height": 6,
  "legend": {"#": "wall", "a": "floor-a", "b": "floor-b"},
  "layers": [{"id": "ground", "rows": [
    "########",
    "#bababa#",
    "#ababab#",
    "#bababa#",
    "#ababab#",
    "########"
  ]}],
  "collision": [
    "########",
    "#......#",
    "#......#",
    "#......#",
    "#......#",
    "########"
  ],
  "defaultSpawn": "from-workshop",
  "spawns": [{"id": "from-workshop", "x": 4, "y": 3, "facing": "left"}],
  "objects": [
    {"id": "demo:object.supply-room.return-door", "frame": "door", "x": 6, "y": 3, "solid": false}
  ],
  "exits": [
    {"id": "to-workshop", "x": 6, "y": 3, "width": 1, "height": 1, "targetMap": "demo:map.workshop", "targetSpawn": "from-supply-room"}
  ],
  "strings": {"en": {"room.name": "Workshop Supply Room"}},
  "messages": []
}
